"WHM Name","WH Name","WH ID","Address","District","State","Capacity(in MT)","Registration Date","Registration Valid Upto","Contact No.","Status","Remarks"
"Ajay Singhal","SAWC PEG BAGHPAT","6721260","OPP GOPICHAND COLLEGE, HARCHANDPUR","Baghpat","UTTAR PRADESH","15000","26-May-2023","25-May-2028","6398019162","Active",""
"ANNAPURNA WAREHOUSING","ANNAPURNA WAREHOUSING","7731659","PAGAR, LALGANJ","Mirzapur","UTTAR PRADESH","50000","06-May-2020","05-May-2025","7571899993","Active",""
"Bahuudheshiya prathmik gramin sahkari samiti Manda","manda sadhan sehkari samiti","6978936","manda khas,","Allahabad","UTTAR PRADESH","100","23-Sep-2024","22-Sep-2029","8726754621","Active",""
"Central Warehousing Corporation","CENTRALL WAREHOUSE SHAHGANJ","4151652","NEAR RAILWAY CROSSING, SUGAR MILL SHAHGANJ","Jaunpur","UTTAR PRADESH","53400","31-Mar-2021","30-Mar-2026","7311171291","Active",""
"Central Warehousing Corporation","CENTRAL WAREHOUSE DUMARIAGANJ","2851661","NEAR BAIDOLA CHAURAHA, DUMARIAGANJ","Siddharthnagar","UTTAR PRADESH","10000","26-Feb-2021","25-Feb-2026","7311171269","Active",""
"Central Warehousing Corporation","CW GORAKHPUR","4450020","Near Nakha Jungle Rly. Station, Fertilizer Factory","Gorakhpur","UTTAR PRADESH","29700","25-Sep-2023","24-Mar-2028","7311171272","Active",""
"Central Warehousing Corporation","Sahibabad II","4371642","A-26, Site- IV, Industrial Area, Sahibabad,","Ghaziabad","UTTAR PRADESH","19513","07-Apr-2021","06-Apr-2026","9811824011","Active",""
"Central Warehousing Corporation","CENTRAL WAREHOUSE CHANDAUSI II","2891641","NAVIN MANDI, CHANDAUSI","Moradabad","UTTAR PRADESH","10640","26-Feb-2021","25-Feb-2026","7311171269","Active",""
"Central Warehousing Corporation","CW SAHARANPUR-I","6786065","JANTA ROAD, SAHARANPUR","Saharanpur","UTTAR PRADESH","26983","26-Sep-2023","25-Dec-2027","8360374940","Active",""
"Central Warehousing Corporation","CENTRAL WAREHOUSE ETAWAH","3451643","NEW KRISHI UTPADAN MANDI SAMITI, BHARTHANA ROAD","Etawah","UTTAR PRADESH","21940","12-Mar-2021","11-Mar-2026","7311171270","Active",""
"Central Warehousing Corporation","CW JHANSI","6787956","CENTRAL WAREHOUSE, SHIVPURI ROAD, NANDANPURA","Jhansi","UTTAR PRADESH","15241","30-Sep-2023","29-Mar-2028","9140629438","Active",""
"Central Warehousing Corporation","CENTRAL WAREHOUSE LUCKNOW II","3171641","NAI MANDI COMPLEX, SITAPUR ROAD","Lucknow","UTTAR PRADESH","7500","08-Mar-2021","07-Mar-2026","9198644040","Active",""
"Central Warehousing Corporation","CENTRAL WAREHOUSE NAINI","3371640","PLOT NO D1, UPSIDC, INDUSTRIAL AREA PO TSL MIRZAPUR ROAD NAINI","Allahabad","UTTAR PRADESH","25600","11-Mar-2021","10-Mar-2026","7311171285","Active",""
"Central Warehousing Corporation","CENTRAL WAREHOUSE SAHARANPUR BD","3471644","PILAKHANI, SAHARANPUR","Saharanpur","UTTAR PRADESH","53750","12-Mar-2021","11-Mar-2026","7311171290","Active",""
"Central Warehousing Corporation","CENTRAL WAREHOUSE SHAHJAHANPUR","3571657","KRISHI UTPADAN MANDI, ROZA SHAHJAHANPUR","Shahjahanpur","UTTAR PRADESH","45700","17-Mar-2021","16-Mar-2026","7311171288","Active",""
"Central Warehousing Corporation","CENTRAL WAREHOUSE BASTI","5011645","PLASTIC COMPLEX, PO PURANI BASTI DIST BASTI","Basti","UTTAR PRADESH","35640","03-May-2021","02-May-2026","7311171262","Active",""
"Central Warehousing Corporation","CENTRAL WAREHOUSE RAMPUR","3531649","PB NO 39 AGAPUR, RAMPUR","Rampur","UTTAR PRADESH","24400","16-Mar-2021","15-Mar-2026","7311171286","Active",""
"Central Warehousing Corporation","CENTRAL WAREHOUSE BISALPUR","2931653","NEAR RAILWAY STATION, BISALPUR","Pilibhit","UTTAR PRADESH","8970","26-Feb-2021","25-Feb-2026","7311171264","Active",""
"Central Warehousing Corporation","CENTRAL WAREHOUSE GHAZIABAD","3571646","PLOT NO C-1 TO 5, INDUSTRIAL AREA BULAND SHAHAR ROAD","Ghaziabad","UTTAR PRADESH","16920","17-Mar-2021","16-Mar-2026","7311171274","Active",""
"Central Warehousing Corporation","Central Warehouse, SURAJPUR","6626048","2/3, Site-B, UPSIDC indl area, Surajpur, Gr Noida","Gautam Buddha Nagar","UTTAR PRADESH","23072","31-Aug-2022","30-Aug-2027","9899435619","Active",""
"Central Warehousing Corporation","CENTRAL WAREHOUSE BIJNORE","4451662","RASULPUR PIRTHI, NAZIBABAD ROAD BIJNORE","Bijnor","UTTAR PRADESH","21470","08-Apr-2021","07-Apr-2026","7311171263","Active",""
"Central Warehousing Corporation","CW LUCKNOW-I","6873186","MOHAN ROAD, NEAR BAWALI CHOWKI","Lucknow","UTTAR PRADESH","26400","29-Feb-2024","28-Feb-2029","8707842520","Active",""
"Central Warehousing Corporation","CENTRAL WAREHOUSE HARDOI","2931676","132 KV POWER STATION, LUCKNOW ROAD HARDOI","Hardoi","UTTAR PRADESH","43200","26-Feb-2021","25-Feb-2026","7311171276","Active",""
"Central Warehousing Corporation","CENTRAL WAREHOUSE FAIZABAD","3071647","NAVIN MANDI RAEBARELI ROAD, FAIZABAD","Faizabad","UTTAR PRADESH","7750","05-Mar-2021","04-Mar-2026","7311171271","Active",""
"Central Warehousing Corporation","CW BALLIA","4470036","Tikhampur, Ballia","Ballia","UTTAR PRADESH","40250","30-Sep-2023","29-Mar-2028","7311171260","Active",""
"Central Warehousing Corporation","CENTRAL WAREHOUSE ROBERTSGANJ","3191659","PIPRI ROAD, ROBERTSGANJ","Sonbhadra","UTTAR PRADESH","5000","08-Mar-2021","07-Mar-2026","7311171287","Active",""
"Central Warehousing Corporation","CW JAHANGIRABAD-I","4490035","Bahipur Doraha, Jahangiranbad","Bulandshahr","UTTAR PRADESH","10000","10-Oct-2023","09-Apr-2028","7311171277","Active",""
"Central Warehousing Corporation","CW CHIRGAON","6830889","KRISHI UTPADAN MANDI, CHIRGAON","Jhansi","UTTAR PRADESH","16660","02-Jan-2024","01-Jan-2029","9198965109","Active",""
"Central Warehousing Corporation","CW Chandausi-I","4530024","Central Warehouse, Chandausi","Moradabad","UTTAR PRADESH","16140","31-Oct-2023","30-Apr-2028","9457475423","Active",""
"Central Warehousing Corporation","CENTRAL WAREHOUSE MUZAFFARNAGAR BD","4051646","BAMANHERI BASE DEPOT, PO RAMPUR","Muzaffarnagar","UTTAR PRADESH","121600","30-Mar-2021","29-Mar-2026","7311171284","Active",""
"Central Warehousing Corporation","CW MUZAFFARNAGAR-I","6787683","CENTRAL WAREHOUSE, KUKRA ROAD","Muzaffarnagar","UTTAR PRADESH","33344","30-Sep-2023","29-Mar-2028","8475855783","Active",""
"Central Warehousing Corporation","CENTRAL WAREHOUSE MAUNATH BHANJAN","3231640","UPSIDC COMPLEX, TAJOPUR MAUNATH","Mau","UTTAR PRADESH","14980","08-Mar-2021","07-Mar-2026","7311171282","Active",""
"Central Warehousing Corporation","CW SHAMLI","6807572","NEW MANDI, BHOSWAL ROAD","Muzaffarnagar","UTTAR PRADESH","5386","29-Nov-2023","28-Nov-2028","7072281844","Active",""
"Central Warehousing Corporation","CENTRAL WAREHOUSE DADRI","2971668","GT ROAD DADRI, DADRI","Gautam Buddha Nagar","UTTAR PRADESH","19000","02-Mar-2021","01-Mar-2026","7311171268","Active",""
"Central Warehousing Corporation","CENTRAL WAREHOUSE BHADOHI","2851671","VILL ISMAILA PO UCHHETA, BHADOHI","Sant Ravidas Nagar (Bhadohi)","UTTAR PRADESH","15000","26-Feb-2021","25-Feb-2026","7311171293","Active",""
"Central Warehousing Corporation","CW BAHRAICH","6767255","P.O. KALPIPARA, BAHRAICH","Bahraich","UTTAR PRADESH","12463","31-Jul-2023","30-Jul-2028","8840419794","Active",""
"Central Warehousing Corporation","CW JAHANGIRABAD-II","6802532","NAVIN MANDI, JAHANGIRABAD","Bulandshahr","UTTAR PRADESH","15000","14-Nov-2023","13-Nov-2028","8077998345","Active",""
"Central Warehousing Corporation","CENTRAL WAREHOUSE GOLA GOKARNATH","5131640","ALIGANJ ROAD GOLA, KHEERI","Kheri","UTTAR PRADESH","15800","12-May-2021","11-May-2026","7311171275","Active",""
"Chandausi warehousing Corporation","Chandausi Warehousing Corporation","6653679","Vill. Bhulawai,Moradabad Road,","Moradabad","UTTAR PRADESH","9463","28-Nov-2022","27-Nov-2027","9837032215","Active",""
"CHANDRA SINGH","C.L. warehouse","6713168","Katkakhanpur, Akbarpur Road, Sultanpur","Sultanpur","UTTAR PRADESH","5000","28-Apr-2023","27-Apr-2028","9415046100","Active",""
"CRD FOODS PRIVATE LIMITED","CRD FOODS PVT LTD CA STORAGE","5011644","KHASRA NO 963 VILLAGE KOSI KHURD BHARATPUR ROAD,","Mathura","UTTAR PRADESH","6200","30-Dec-2019","29-Dec-2024","9760366008","Active",""
"IMAGINE ENTERPRISES","IMAGINE ENTERPRISES PHASE-1","6669873","VILL- Jijauli, POST-JIJAULI NEAR INHAUNA","Rae Bareli","UTTAR PRADESH","8340","03-Jan-2023","02-Jan-2028","7355001747","Active",""
"IMAGINE ENTERPRISES","IMAGINE ENTERPRISES phase -2","6674469","VILL -AZADPUR, POST-JIJAULI NEAR INHAUNA","Rae Bareli","UTTAR PRADESH","17500","17-Jan-2023","16-Jan-2028","9536312215","Active",""
"Janhavi Promoters Private Limited","GRAM VIKAS SHEET GRAH","9551656","3rd KM JANSATH ROAD, MUZAFFARNAGAR","Muzaffarnagar","UTTAR PRADESH","850","01-Dec-2020","30-Nov-2025","9460060009","Inactive","EFFECTIVE CONTROL EXPIRED"
"kabita singh","M/S KAVITA SINGH WAREHOUSE","6708572","VILL-Rajapur kharhar, varanasi road","Pratapgarh","UTTAR PRADESH","5000","13-Apr-2023","12-Apr-2028","9415627707","Active",""
"KAI WAREHOUSING PRIVATE LIMITED","KAI WAREHOUSING PRIVATE LIMITED","8851643","VILL:- CHHATIYA, MATHURA ROAD, UJJHANI","Budaun","UTTAR PRADESH","6348","14-Sep-2020","13-Sep-2025","9837045480","Active",""
"KAI WAREHOUSING PRIVATE LIMITED","KAI WAREHOUSING PVT LTD","6712624","UMERCIA, FARIDPUR ROAD","Bareilly","UTTAR PRADESH","14865","28-Apr-2023","27-Apr-2028","9837045480","Active",""
"KAI WAREHOUSING PRIVATE LIMITED","KAI WAREHOUSING PVT LTD","6574479","VILL GOPALPUR TALUKA NAGARIA, NAGARIRA MOAR SHAHJANPUR","Shahjahanpur","UTTAR PRADESH","1715","13-May-2022","12-Nov-2024","9837045480","Suspended",""
"KAMAL SINGH","M/S KAMAL SINGH","6781298","purekhusai, mohanganj","Pratapgarh","UTTAR PRADESH","5000","13-Sep-2023","12-Sep-2028","9473771124","Active",""
"KARAN SINGH","Nandani Infrastructure","6777064","Village Aashapur, Post Dubeypur(Antu), Pratapgarh,","Pratapgarh","UTTAR PRADESH","40000","29-Aug-2023","28-Aug-2028","9984429000","Active",""
"KETKI SINGH","P.E.G. LALPUR CHANDRABHAN, UNIT A GONDA","6776348","VILLAGE LALPUR CHANDRABHAN, POST PATHWALIA","Gonda","UTTAR PRADESH","10000","29-Aug-2023","28-Aug-2028","9984429000","Active",""
"KETKI SINGH","PEG LALPUR CHANDRABHAN UNIT B GONDA","6727747","VILLAGE LALPUR CHANDRABHAN, POST PATHWALIA","Gonda","UTTAR PRADESH","10000","01-Jun-2023","31-May-2028","9984429000","Active",""
"KETKI SINGH","P.E.G. LALPUR CHANDRABHAN, UNIT C GONDA","6727564","VILLAGE LALPUR CHANDRABHAN, POST PATHWALIA","Gonda","UTTAR PRADESH","5000","01-Jun-2023","31-May-2028","9984429000","Active",""
"KIRAN MALIK","KIRAN MALIK","6672661","MUNDIYA KHURD SWAR ROAD BILASPUR,","Rampur","UTTAR PRADESH","7500","16-Jan-2023","15-Jan-2028","9810135255","Active",""
"Kisan Seva Sahkari Samiti ltd.Bhatona","Kisan seva sahkri samiti ltd . Bhatona","6834758","Bhatona,","Bulandshahr","UTTAR PRADESH","100","11-Jan-2024","10-Jan-2029","9719878874","Active",""
"KISAN SEWA SAHKARI SAMITI LTD. BARALOKPUR CHAUPLA","KISAN SEWA SAHKARI SAMITI LTD. BARALOKPUR (CHAUPLA)","9151648","village chaupla, baralokpur","Etawah","UTTAR PRADESH","250","22-Oct-2020","21-Jan-2025","9368569029","Active",""
"M/S SHRI ANANDESHWAR PRESERVATIONS PRIVATE LTD","M/S SHRI ANANDESHWAR PRESERVATIONS PRIVATE LTD","6922058","M/S SHRI ANANDESHWAR PRESERVATIONS PRIVATE LTD,ARAZI NO-1401,GRAM BARA,AKBARPUR,","Kanpur Dehat","UTTAR PRADESH","5019","25-Apr-2024","24-Apr-2029","9839213962","Active",""
"MAYANK VARSHNEY","SHREE SAI KRIPA WAREHOUSE","6750699","Village Mai, Budaun Road, Chandausi,","Moradabad","UTTAR PRADESH","5452","30-Jun-2023","29-Jun-2028","9368446849","Active",""
"Mohar singh Bhadauriya","Maya devi warehouse","6769954","Sahabray ka pura, Pharaira","Agra","UTTAR PRADESH","2255","08-Aug-2023","07-Aug-2028","9917330777","Inactive","EXPIRED INSURANCE"
"Najiya Rehman","Bhanauli Warehouse","6932131","Bhanauli warehouse Vill & post- Bhanauli,, Nawabganj,Distt-Barabanki","Bara Banki","UTTAR PRADESH","5054","20-May-2024","19-May-2029","9935149824","Active",""
"National Commodities Management Services Limited","NCML OWN WAREHOUSE","6912158","SURVEY NO 372, 374 & 377 GH AND 415 VILLAGE RAMPUR, POST BHIMSEN TALUKA AND DISTRICT- KANPUR NAGAR UTTAR PRADESH PIN 209305","Kanpur Nagar","UTTAR PRADESH","4023","11-Apr-2024","10-Oct-2028","9454850619","Active",""
"Orai Oil Chem Private Limited","Orai Oil Chem Private Limited","6877955","D17, Industrial Area, Kalpi Road, Orai,","Jalaun","UTTAR PRADESH","5000","05-Mar-2024","04-Mar-2029","8299871756","Active",""
"Pratibha Asati","SHRI DHANUSHDHARI WAREHOUSING","6675722","KHARSA NO 323 PACHORO ROAD, NH 39 MAURANIPUR JHANSI ROAD","Jhansi","UTTAR PRADESH","5000","19-Jan-2023","18-Jan-2028","7084459990","Active",""
"R S P AGRO INDUSTRIES PRIVATE LTD","R S P Agro Industries Pvt Ltd","6963185","Gata no. 56,57 Village rehapura Faridpur Bareilly 243503, Rehapura","Bareilly","UTTAR PRADESH","8415","31-Jul-2024","30-Jul-2029","9412288631","Active",""
"Ruma Agarwal","SR CHEMICALS","6715775","Bhedpur,Pargana jamour, Tehsil Sadar","Shahjahanpur","UTTAR PRADESH","6907","10-May-2023","09-May-2028","7080804012","Active",""
"SADHAN SAHAKARI SAMIT LMT. BADHAUNA","SADHAN SAHAKARI SAMIT LTD. BADHAUNA","8111658","BADHAUNA,","Jaunpur","UTTAR PRADESH","250","08-Jun-2020","07-Jun-2025","9415438410","Active",""
"SAHKARI SANGH LTD RAJMAU","SAHKARI SANGH LTD. RAJMAU","6171645","VILLAGE BAIDPURA,","Etawah","UTTAR PRADESH","250","23-Jul-2021","22-Jan-2026","9454403282","Active",""
"SAROJ RAI","Saroj Rai Warehousing","6918999","Khasra No-1141,1142,1143,1144,","Ghazipur","UTTAR PRADESH","18698","23-Apr-2024","22-Oct-2028","6307089945","Active",""
"saroj singh","S.S.Warehouse","6715411","Bhadaiyan,","Sultanpur","UTTAR PRADESH","5000","08-May-2023","07-May-2028","8009903200","Active",""
"Sarvesh Kumari","BBB Warehouse","6571145","near Mandi samiti Kasganj Amanpur road,","Kanshiram Nagar","UTTAR PRADESH","4454","27-Apr-2022","26-Apr-2027","9899246785","Active",""
"SHASHIDHAR MISHRA","Sabya Sanchi Cold Storage","6543516","Near Mandi, Bahraich Road","Kheri","UTTAR PRADESH","12201","29-Nov-2021","28-Nov-2026","9415148929","Inactive","EXPIRED/INSUFFICIENT INSURANCE"
"Shivangi Agarwal","M/S SHANTI PRABHAT ICE & COLD STORAGE","6869226","Village-NABIKOTA NANDAN,LUCKNOW SITAPUR ROAD, GATA NO-37,50,65S &66 BAKSHI KA TALAB","Lucknow","UTTAR PRADESH","5675","22-Feb-2024","21-Nov-2028","9648876000","Active",""
"SHRI ANANDESWARA COLD STORAGE PVT LTD","Shri Anandeshwara cold storage private ltd","6715502","ARAZI NO-568 Tiwaripur Salempur,Tehsil-Narwal,","Kanpur Nagar","UTTAR PRADESH","6967","08-May-2023","07-May-2028","9336837769","Suspended",""
"Shri Gupti Sagar Cold Storage","Shri Gupti Sagar Cold Storage","6709562","Muzaffar nagar Road,","Muzaffarnagar","UTTAR PRADESH","2003","17-Apr-2023","16-Apr-2028","9997313309","Suspended",""
"SHRIVIDHYASAGAR WAREHOUSE LLP","SHRIVIDHYASAGAR WAREHOUSE LLP","6989198","Near Amarpur Naveen Galla Mandi, Jhansi Highway Road, Gram Ronda,Lalitpur,","Lalitpur","UTTAR PRADESH","11957","28-Oct-2024","27-Oct-2029","7376999901","Active",""
"SR FOOD CHAIN","SR FOOD CHAIN","6671945","Vill-Chackbhitara near bantara,sitapur road,","Shahjahanpur","UTTAR PRADESH","4842","11-Jan-2023","10-Jan-2028","7080804016","Active",""
"STEINWEG-SHARAF INDIA PRIVATE LIMITED","Steinweg Sharaf India Pvt Ltd C/O Gupta Suppliers Company Warehouse","6584106","Khasra No. 137 Village Badagaon, Teshsil Nawabaganj Barabanki","Bara Banki","UTTAR PRADESH","1406","29-May-2022","28-May-2027","9907489205","Active",""
"SVC INDUSTRIES LIMITED","SVC Warehouse","6541445","SVC Industries Limited,1, BARSANA ROAD,,","Mathura","UTTAR PRADESH","1308","16-Nov-2021","15-Nov-2026","9758674589","Active",""
"Unnao Ice and Cold Storage","Unnao Ice and Cold Storage","6922595","Gram Post Banthar,Near UPSIDC Industrial Area,Unnao,","Unnao","UTTAR PRADESH","5462","26-Apr-2024","25-Apr-2029","9415045688","Active",""
"UP. COOPERATIVE FEDERATION LIMITED","TILAURA PAALI","6962468","GORAKHPUR,","Gorakhpur","UTTAR PRADESH","600","29-Jul-2024","28-Jan-2029","8765984490","Active",""
"UP. COOPERATIVE FEDERATION LIMITED","MOTIGANJ GODAM GONDA","6957245","MOTIGANJ, MANKAPUR","Gonda","UTTAR PRADESH","1800","11-Jul-2024","10-Jan-2029","8765984433","Active",""
"UP. COOPERATIVE FEDERATION LIMITED","Pcf Mujaffarnagar Begrajpur khautauli","6958862","BEGRAJPUR,","Muzaffarnagar","UTTAR PRADESH","6000","15-Jul-2024","14-Jan-2029","8765984974","Active",""
"UP. COOPERATIVE FEDERATION LIMITED","PCF ORAI BUFFER GODOWN KONCH","6957872","MANDI PARISAR KONCH, KONCH","Jalaun","UTTAR PRADESH","1800","12-Jul-2024","11-Jan-2029","8765985001","Active",""
"Uttar Pradesh State Warehousing Corporation","U.P. STATE WAREHOUSE VISHIST MANDI BHOJLA","6590228","U.P. STATE WAREHOUSE VISHIST MANDI BHOJLA,","Jhansi","UTTAR PRADESH","5000","01-Jun-2022","31-May-2027","9076519010","Active",""
"Uttar Pradesh State Warehousing Corporation","UP STATE WAREHOUSE MUSKARA, RATH","6589683","Naveen Galla Mandi,, Hamirpur road Muskara","Hamirpur","UTTAR PRADESH","5000","01-Jun-2022","31-May-2027","6390003167","Active",""
"Uttar Pradesh State Warehousing Corporation","UP State Warehouse Pattan Dhoos","6543334","Pipraicha Pattan Dhoos Kushinagar,","Kushinagar","UTTAR PRADESH","24360","25-Nov-2021","24-Nov-2026","9839444625","Active",""
"Uttar Pradesh State Warehousing Corporation","SWC PEG RAMKOT","6536494","UPSWC,","Sitapur","UTTAR PRADESH","10000","07-Oct-2021","06-Oct-2026","6390003153","Active",""
"Uttar Pradesh State Warehousing Corporation","PEG RASRA BALLIA","6672398","KRISHI UTPADAN MANDI SAMITI, RASRA","Ballia","UTTAR PRADESH","5000","12-Jan-2023","11-Jan-2028","9415834741","Active",""
"Uttar Pradesh State Warehousing Corporation","PEG BHAWANIPUR 1ST(SUKHVEER AGRO ENERGY)","6640981","SUKHVEER AGRO ENERGY LTD. BHAWANIPUR VINDHYACHAL, MIRZAPUR","Mirzapur","UTTAR PRADESH","35500","13-Oct-2022","12-Oct-2027","9076519033","Active",""
"Uttar Pradesh State Warehousing Corporation","UP STATE WAREHOUSING CORPORATION, ARRA PAHADPUR FARRUKHABAD","6622260","NAVEEN MANDI STHAL, ARRA PAHADPUR, FARRUKHABAD","Farrukhabad","UTTAR PRADESH","5000","29-Aug-2022","28-Aug-2027","9076518929","Active",""
"Uttar Pradesh State Warehousing Corporation","UPSWC BHARTHANA","6546667","PADIYAPURA, BHARTHANA,","Etawah","UTTAR PRADESH","11450","20-Dec-2021","19-Dec-2026","9076518983","Active",""
"Uttar Pradesh State Warehousing Corporation","UP STATE WARE HOUSE JUNGLEOON KHALILABAD","6652770","UP STATE WARE HOUSE JUNGLEOON KHALILABAD,","Sant Kabir Nagar","UTTAR PRADESH","5040","21-Nov-2022","20-Nov-2027","9076518916","Active",""
"Uttar Pradesh State Warehousing Corporation","MISRIKH","6616684","UPSWC,","Sitapur","UTTAR PRADESH","17334","16-Aug-2022","15-Aug-2027","9026907282","Active",""
"Uttar Pradesh State Warehousing Corporation","UPSWC I.A NEW UNIT BAREILLY","6540454","INFRONT OF BHARAT GAS PLANT PARSAKHEDA ROAD NUMBER 4 BAREILLY,","Bareilly","UTTAR PRADESH","45000","03-Nov-2021","02-Nov-2026","9076518972","Active",""
"Uttar Pradesh State Warehousing Corporation","Kursi Road SWC","6640262","Industrial Area Near Umra Chauraha Barabanki,","Bara Banki","UTTAR PRADESH","16200","11-Oct-2022","10-Oct-2027","9076518955","Active",""
"Uttar Pradesh State Warehousing Corporation","swc babrala","6545040","swc babrala, swc babbrala","Moradabad","UTTAR PRADESH","23500","07-Dec-2021","06-Dec-2026","6390003162","Active",""
"Uttar Pradesh State Warehousing Corporation","UPSWC ALIGARH","6535868","NEAR TVS SHOWROOM SOOTMILL G.T.ROAD ALIGARH,","Aligarh","UTTAR PRADESH","59125","06-Oct-2021","05-Oct-2026","6390003168","Active",""
"Uttar Pradesh State Warehousing Corporation","SANDEELA","6587794","UPSWC,","Hardoi","UTTAR PRADESH","20020","31-May-2022","30-May-2027","6390003154","Active",""
"Uttar Pradesh State Warehousing Corporation","PEG Nathoopura (Mahoba)","6974885","Vill-Nathoopura,","Mahoba","UTTAR PRADESH","15000","04-Sep-2024","03-Sep-2029","9076518819","Active",""
"Uttar Pradesh State Warehousing Corporation","AGRA CITY","6655567","NEAR MANDI SAMATI FIROZABAD ROAD AGRA,","Agra","UTTAR PRADESH","11420","30-Nov-2022","28-Feb-2027","9076519018","Active",""
"Uttar Pradesh State Warehousing Corporation","UPSWC KHIMSEPUR","6544324","DHEERPUR CHURAHA, KHIMSEPUR,","Farrukhabad","UTTAR PRADESH","34500","03-Dec-2021","02-Dec-2026","9076518928","Active",""
"Uttar Pradesh State Warehousing Corporation","UPSWC I.A. ETAWAH","6535777","SARAI ESAR ETAWAH,","Etawah","UTTAR PRADESH","64220","05-Oct-2021","04-Oct-2026","9076818925","Active",""
"Uttar Pradesh State Warehousing Corporation","Uttar Pradesh State Warehousing Corporation, Warehouse Pahasu","6538656","Khurja Road Pahasu,","Bulandshahr","UTTAR PRADESH","6722","27-Oct-2021","26-Oct-2026","9076518818","Active",""
"Uttar Pradesh State Warehousing Corporation","UPSWC JASWANT NAGAR","6544506","NH-2 HIGHWAY, SAFAI ROAD JASWANTNAGAR,","Etawah","UTTAR PRADESH","18620","06-Dec-2021","05-Dec-2026","9076518926","Active",""
"Uttar Pradesh State Warehousing Corporation","U.P. State Warehouse Charkhari, Mahoba","6590137","Vishishth Mandi Supa, Mahoba,","Mahoba","UTTAR PRADESH","5000","01-Jun-2022","31-May-2027","9076519017","Active",""
"Uttar Pradesh State Warehousing Corporation","UPSWC JAINPUR","6595805","JAINPUR, KANPUR DEHAT,","Kanpur Dehat","UTTAR PRADESH","28900","16-Jun-2022","15-Jun-2027","9076518933","Active",""
"Uttar Pradesh State Warehousing Corporation","UPSWC ETAH","6535686","SAITHARI G.T.ROAD ETAH,","Etah","UTTAR PRADESH","64940","04-Oct-2021","03-Oct-2026","9076519027","Active",""
"Uttar Pradesh State Warehousing Corporation","RAIBAREILLY","6599401","UPSWC,","Rae Bareli","UTTAR PRADESH","12672","01-Jul-2022","30-Jun-2027","9076518952","Active",""
"Uttar Pradesh State Warehousing Corporation","UPSWC Baheri","6534788","UP State Warehouse,Near Mandi Samiti, Narayan Nagla Road,Baheri,","Bareilly","UTTAR PRADESH","15350","29-Sep-2021","28-Sep-2026","9076518974","Active",""
"Uttar Pradesh State Warehousing Corporation","UP STATE WAREHOUSE MANDI SAMITI PARATAWAL","6598056","MANDI SAMITI PARATAWAL,","Mahrajganj","UTTAR PRADESH","5000","28-Jun-2022","27-Jun-2027","9076518914","Active",""
"Uttar Pradesh State Warehousing Corporation","UP State Warehouse IA Gorakhpur (GIDA)","6540819","GIDA Sector 22,","Gorakhpur","UTTAR PRADESH","30240","10-Nov-2021","09-Nov-2026","9076518912","Active",""
"Uttar Pradesh State Warehousing Corporation","swc gajraula","6547566","INDUSTRIAL AREA SWC GAJRAULA, swc gajraula","Jyotiba Phule Nagar","UTTAR PRADESH","61576","24-Dec-2021","23-Dec-2026","9076518921","Active",""
"Uttar Pradesh State Warehousing Corporation","bangarmau","6572762","unnao hardoi road,","Unnao","UTTAR PRADESH","8730","29-Apr-2022","28-Apr-2027","9076518951","Active",""
"Uttar Pradesh State Warehousing Corporation","UPSWC SIKANDRARAU","6534515","NAVEEN MANDI SIKANDRARAU,","Mahamaya Nagar","UTTAR PRADESH","3000","29-Sep-2021","28-Sep-2026","6390007134","Active",""
"Uttar Pradesh State Warehousing Corporation","Upswc jamaur-A","6539647","up state warehosing, jalala bad road, jamaur - A shahjahanpur,","Shahjahanpur","UTTAR PRADESH","66515","31-Oct-2021","30-Oct-2026","9076518982","Active",""
"Uttar Pradesh State Warehousing Corporation","peg jhijhak","6648729","krishi utpadan mandi samiti, jhijhak","Kanpur Dehat","UTTAR PRADESH","5000","02-Nov-2022","01-Nov-2027","6386891320","Active",""
"Uttar Pradesh State Warehousing Corporation","up state warehousing corporation mandi samiti rampur","6537302","up state warehousing corporation mandi samiti rampur, up state warehousing corporation mandi samiti rampur","Rampur","UTTAR PRADESH","5000","22-Oct-2021","21-Oct-2026","9076518923","Active",""
"Uttar Pradesh State Warehousing Corporation","UP STATE WAREHOUSE RASAHARA","6650618","VILLAGE RASAHARA POST MADHOPUR DIST. SANTKABIRNAGAR,","Sant Kabir Nagar","UTTAR PRADESH","20000","09-Nov-2022","08-Nov-2027","9161537244","Inactive","EFFECTIVE CONTROL EXPIRED"
"Uttar Pradesh State Warehousing Corporation","PEG MALIHAMAU","6572408","UPSWC,","Hardoi","UTTAR PRADESH","26667","29-Apr-2022","28-Apr-2027","9076518947","Active",""
"Uttar Pradesh State Warehousing Corporation","U.P. STATE WAREHOUSE JAYAS","6594998","Krishi Utpadan Mandi Samiti Bahadurpur, Amethi, U.P., Krishi Utpadan Mandi Samiti Bahadurpur, Amethi, U.P.","Sultanpur","UTTAR PRADESH","10600","13-Jun-2022","12-Jun-2027","9076518959","Active",""
"Uttar Pradesh State Warehousing Corporation","SITAPUR MANDI","6566822","UPSWC,","Sitapur","UTTAR PRADESH","14840","30-Mar-2022","29-Mar-2027","6386909015","Active",""
"Uttar Pradesh State Warehousing Corporation","UPSWC Hathras","5931645","UP State warehousing corporation Naveen Mandi Aligarh Road Hathras,","Mahamaya Nagar","UTTAR PRADESH","9524","06-Jul-2021","05-Jul-2026","9076519028","Active",""
"Uttar Pradesh State Warehousing Corporation","PEG BASANTPUR","6642243","TENDAWA BASANTPUR, NEAR BUDDHA RESORT LKO ROAD","Bahraich","UTTAR PRADESH","80000","17-Oct-2022","16-Oct-2027","9076518967","Inactive","EFFECTIVE CONTROL EXPIRED"
"Uttar Pradesh State Warehousing Corporation","SWC Jalaun","6735039","Naveen Mandi Sthal, Lona Road","Jalaun","UTTAR PRADESH","11400","13-Jun-2023","12-Jun-2028","9076518819","Active",""
"Uttar Pradesh State Warehousing Corporation","UP STATE WAREHOUSING CORPORATION PEG JUNGLE JOGIYABARI","6588156","UP STATE WAREHOUSING CORPORATION PEG JUNGLE JOGIYABARI ANANDNAGAR, POST GOPALPUR SHAH","Mahrajganj","UTTAR PRADESH","10000","31-May-2022","30-May-2027","6392882864","Inactive","EFFECTIVE CONTROL EXPIRED"
"Uttar Pradesh State Warehousing Corporation","UPSWC DEOKATHIA GHAZIPUR","6548283","DEOKATHIA,","Ghazipur","UTTAR PRADESH","7000","03-Jan-2022","02-Jan-2027","9076518876","Active",""
"Uttar Pradesh State Warehousing Corporation","U.P. State Warehouse, Pratapgarh","6583926","Ranjeetpur, Chilbila, Mahuli,","Pratapgarh","UTTAR PRADESH","7680","29-May-2022","28-May-2027","9076518817","Active",""
